grant_num,funder,prj_name,website,loc_notes,y_coord,x_coord,strt_date,end_date,completed,prj_desc,rest_activity,icon,map_icon
0819-E-OR-W,Grant Soil and Water Conservation District,Camp Creek Legacy Log Weir Removal Phase 1,,,44.66433,-118.808525,4/15/2009,12/31/2011,0,"Funding to Phase 1 of the Camp Creek Log Weir Removal Project addressed legacy log weirs in Camp Creek. Placed in the 1980's the legacy weirs altered hydrology and sediment routing, and in some instances created new passage barriers. This project removed or replaced 28 log weirs to encourage a healthy pool/riffle sequence with natural stream channel characteristics.","Weir Removal, Instream Large Wood Placement",Barrier Removal,1
1003-E-OR-WF,Grant Soil and Water Conservation District,Camp Creek Log Weir Removal Project Phase II,,,44.65279,-118.826141,8/2/2010,12/31/2011,0,"Funding for phase two of the Camp Creek Log Weir Removal Project supported the removal and modification of 133 legacy log weir structures in both Lick Creek and Camp Creek. The installation of appropriate restoration structures, where legacy structures were removed, will accelerate the recovery process to more quickly decrease the width/depth ratio, create pools, capture spawning gravels, and increase sinuosity.","Weir Removal, Instream Large Wood Placement",Barrier Removal,1
0818-EP-OR-WF,USDA Forest Service- Malheur National Forest,Camp Creek Watershed Culvert Replacement,http://www.fs.usda.gov/malheur/,,44.686096,-118.796768,10/1/2008,9/30/2009,1,"The Granite Boulder Creek Culvert Replacement Project replaced two side-by-side culverts with an open bottom box culvert. This work, in addition to removal of a weir below the culverts, opened access to 4 miles of spawning and rearing habitat for Chinook salmon, mid-Columbia Steelhead and Bull trout.","Culvert Replacement, Weir Removal",Barrier Removal,1
1101-E-WA-N,Confederated Tribes and Bands of the Yakama Nation,Condit Dam Riparian Restoration ,http://www.yakamanation-nsn.gov/index.php,,45.766667,-121.516667,12/1/2011,12/1/2013,0,"Since 1913, the Condit Hydroelectric Project at rivermile 3.3 of the White Salmon River has blocked upstream access for ESA-listed salmon, steelhead and anadromous lamprey. After removal of the dam by PacifiCorp in October 2011, up to 33 miles of rearing habitat will be opened to anadromous fish. With this grant, the Yakama Nation will work with volunteers and contractors to revegetate the new riparian zone, with the goal of reduce inputs of sediment and improving habitat. ","Large Dam Removal, Riparian Planting and Revegetation, Community Engagement",Barrier Removal,1
0905-E-OR-NWF,North Fork John Day Watershed Council ,Desolation Creek Watershed Culvert Replacement,http://www.nfjdwc.org/,fixed in the GIS-not in the LAT LONG DONE,44.897305,-118.795296,5/12/2009,9/30/2011,1,"The Bruin Creek Culvert Removal Project replaced a failed, perched culvert with a new bottomless culvert bridge in 2011, opening 2 miles of spawning and 4 miles of rearing stream habitat, restoring natural channel processes and morphology, and stabilizing the roadbed to reduce future sediment loading.","Culvert Replacement, Streambank Stabilization ",Barrier Removal,1
0804-E-OR-N,Jackson County ,Gold Ray Dam Removal Sediment Study,http://www.co.jackson.or.us,,42.433333,-122.983889,7/16/2008,12/31/2009,1,"This grant funded a sediment study necessary to obtain permits for removal of the Gold Ray Dam, a defunct hydroelectric facility built in 1904. Following the study, Jackson County received $5 million from the National Oceanic and Atmospheric Administration to remove the dam. Ultimate removal of the dam in 2010 opened more than 300 miles of river and stream habitat to anadromous fish, and restored natural processes to the river and floodplain.","Baseline or Project Monitoring; Assessment, Planning, or Design",Barrier Removal,1
0801-E-OR-NF,Confederated Tribes of the Umatilla Indian Reservation ,Granite & Battle Creek Culvert Replacement,http://www.umatilla.nsn.us/salmon.html,,44.851133,-118.398533,6/30/2008,9/30/2010,1,"This project replaced two culverts; one on Battle Creek, and another on Granite Creek.  These culverts were replaced to improve fish passage, restore natural hydrologic and stream processes, and increase habitat. The creeks are now important cold-water refugia for listed and non-listed species during warm summer months.",Culvert Replacement,Barrier Removal,1
1108-E-OR-NF,North Fork John Day Watershed Council,Granite Creek Watershed Restoration,http://www.nfjdwc.org/,,44.774846,-118.457037,6/27/2011,4/30/2013,0,This effort along Granite Creek addresses the highest priority factors impacting water quality for salmonids. The Granite Creek Restoration Project will improve overall stream health and function in the Granite Creek Watershed through: the removal and replacement of eight barriers on roads that currently impede salmonid passage; assessment of the Black Jack mine settling pond function (an abandoned lode mine on Forest Service land); assessment at the Red Boy Mine (on private land) to mitigate current acid mine discharge; and noxious weed control/treatments at restoration project sites and priority areas within the watershed. ,"Culvert Removal, Culvert Replacement, Riparian Planting and Revegetation, Mine Assessment, Baseline or Project Monitoring",Barrier Removal,1
0807-EP-WA-NF,Mid-Columbia Fisheries Enhancement Group,Hemlock Dam Removal,http://midcolumbiarfeg.com/,Moved in the GIS-not in LAT LONG DONE,45.799225,-121.903641,6/11/2008,10/15/2009,1,"Funding assisted with the removal of the Hemlock Dam on Trout Creek, a tributary of the Wind River. Dam removal improved fish access to a 21,000-acre watershed with over 15 miles of potentially excellent habitat. Eliminating the reservoir also removed a major source of heating to Trout Creek waters - which typically exceeded state temperature standards more than 70 days per year - and re-established sediment movement to approximately two miles of sediment-starved reaches of lower Trout Creek.",Large Dam Removal,Barrier Removal,1
1114-E-OR-NW,Wheeler Soil and Water Conservation District,Lower Butte Creek Fish Passage,http://www.wheelerswcd.org/,GOOD,45.057222,-120.369167,8/15/2011,7/31/2013,0,"Butte Creek is a high priority watershed for steelhead spawning and rearing. To date, 17 fish passage projects have been completed within the Butte Creek watershed. Three barriers still remain in the lower reaches of Butte Creek that, once removed, will open up over 32.2 miles of identified summer steelhead spawning and rearing habitat. This project will correct the last three barriers on Lower Butte Creek by replacing three existing culverts with bridges.","Culvert Replacement, Livestock Management",Barrier Removal,1
0805-E-WA-N,Mason Conservation District,Skokomish Watershed Restoration,http://www.masoncd.org/,,47.402,-123.24,9/18/2008,12/31/2009,1,Grant funding assisted the Mason Bridge Project restoration of fish passage in Gibbons Creek in the Skokomish North Fork watershed.  A 5' diameter culvert with a 10' drop at the outlet previously eliminated fish passage and access to the upper 1.1 miles of Gibbons Creek. The culvert and road fill were removed and a 65' pre-fabricated bridge was installed and the stream was restored including construction of rock riffles and the installation of large wood.  ,"Culvert Replacement, Instream Rock Weir Placement, Instream Large Wood Placement",Barrier Removal,1
0910-E-WA-N,Skagit River System Cooperative,Turner's Bay Lagoon Reconnection,http://www.skagitcoop.org/,GOOD,48.45,-122.55,5/29/2009,3/15/2012,0,"Grant funding provided to the Turner's Bay Lagoon Project is helping restore fish access and unmuted tidal flow to a 60-acre pocket estuary. Tidal flow is currently limited by a non-functioning tide gate at a road crossing.  Work completed during this phase focused on protection of existing site infrastructure, including a natural gas pipeline and other utilities, local properties, and a county road, so that removal of the road prism could then proceed.","Tidegate Replacement or Removal, Road Decommissioned or Closed, Wetland Restoration",Barrier Removal,1
1010-EP-WA-NF,Mid-Columbia Fisheries Enhancement Group,Wind River Watershed Fish Passage Improvement,http://midcolumbiarfeg.com/,,45.785186,-121.946133,5/20/2010,11/30/2012,0,"The Wind River Watershed Fish Passage Improvement project decommissioned 2.5 miles of road and eliminated culverts at a total of 20 stream crossings, four of which were passage barriers. Additionally, a small concrete dam will be removed on Martha Creek, a tributary to Trout Creek in the Wind River basin, and replanting of trees occurred in the riparian zone.","Culvert Removal, Push-up or Diversion Dam Removal, Road Decommissioned or Closed, Riparian Planting and Revegetation",Barrier Removal,1
0815-E-OR-NF,The Wetlands Conservancy,Bayview Oxbow Reconnection Study,http://oregonwetlands.net/,,44.446283,-124.043175,6/26/2008,12/31/2009,1,"This grant provided funding to the Wetlands Conservancy for the Bayview Oxbow Reconnection Feasibility Study. The study assessed the feasibility and actions required to restore historic connections and high marsh habitat of the Bayview Oxbow site. The Wetlands Conservancy has purchased a large portion of the site, which was a former tidal wetland connected to Alsea Bay.","Baseline or Project Monitoring; Assessment, Planning, or Design",Instream Restoration,2
1106-E-OR-F,USDA Forest Service - Malheur National Forest,Camp Creek Watershed Large Wood Placement,http://www.fs.usda.gov/malheur/,,44.63,-118.826141,8/15/2011,6/30/2013,0,"Project activities will include felling of trees into Lick Creek to restore instream channel complexity, increase pool frequency, protect and establish riparian hardwoods within the floodplain, facilitate stream channel narrowing, establish floodplain connectivity where the channel is incised, and inhibit access to the stream floodplain by livestock.  All  described activities will benefit Middle Columbia River Steelhead, their designated critical habitat within coldwater headwater refugia of the Camp Creek Watershed, and facilitate resistance and resilience within the riparian areas to natural disturbances and climate change in the future.","Instream Large Wood Placement, Thinning",Instream Restoration,2
1008-E-ID-N,Latah Soil and Water Conservation District ,Corral Creek Racetrack Meadow Phase 1,http://www.latahsoil.org/,,46.803645,-116.474948,4/13/2010,6/30/2011,1,"All phases of this project will restore 0.21 stream miles of Corral Creek and 13.7 acres of riparian and wetland area that were negatively impacted by historic channel straightening and floodplain compaction by horse racing. The ultimate goal is to return the stream to its historic channel, re-establish vegetation in some of the riparian areas, and construct practices to slow water flow to hydrate the surrounding meadow and enhance groundwater recharge. Funding supported an engineering analysis, restoration plan design, and initiation of permitting. ","Assessment, Planning, or Design; Baseline or Project Monitoring",Instream Restoration,2
1105-E-ID-N,Latah Soil and Water Conservation District ,Corral Creek Racetrack Meadow Phase 2,http://www.latahsoil.org/,,46.824,-116.49,12/1/2011,12/1/2013,0,"Phase 2 of the Corral Creek Racetrack project will include completion of the permitting and consultation process, development of a conservation plan and contract with the private landowner, initiation of long-term water and vegetation monitoring, collection of plant materials, instream construction (diversions and channel plugs), road decommissioning, revegetation, and installation of riparian exclusion fencing.  This project will complement nearby restoration projects completed in this watershed to improve habitat for Snake River A-run (wild) steelhead.","Assessment, Planning, or Design; Baseline or Project Monitoring",Instream Restoration,2
1107-E-WA-NF,Mount St. Helens Institute,East Fork Lewis and Muddy River Habitat Enhancement,http://www.mshinstitute.org/,,45.811394,-122.139031,7/6/2011,6/30/2013,0,"This project consists of habitat enhancement activities on both the East Fork Lewis River and the Muddy River. On the East Fork Lewis, 11 log jams constructed of full-length logs were placed by helicopter along 0.75 miles of the river. Approximately 40 log complexes will also be placed along one tributary and two side channels of the Muddy River. These 51 structures are intended to capture spawning gravel and create rearing pools along reaches that have been scoured as a result of historic anthropogenic activities.","Instream Large Wood Placement, Instream Log Jam Placement, Instream Rootwad Placement, Community Engagement, Baseline or Project Monitoring",Instream Restoration,2
1015-E-OR-NW,Partnership for the Umpqua Rivers,Elk Creek Watershed Salmon Recovery Project,http://www.umpquarivers.org/,,42.86,-122.88,7/23/2010,9/30/2011,1,"Funding provided to the Elk Creek Watershed Salmon Recovery Project assists with a community-based stream restoration project for the South Umpqua Elk Creek watershed. Two demonstration projects will rebuild instream habitat with logs and boulders and restore riparian areas with a mix of native plant species. Reestablishment of beaver colonies and their ponds will provide a complex and abundant nutrient supply for fish, as well as silt retention.","Instream Boulder Placement, Instream Large Wood Placement, Beaver Introduction or Management, Riparian Planting and Revegetation, Community Engagement",Instream Restoration,2
1002-E-WA-N,Columbia River Estuary Study Task Force (CREST),Grays River Whole Watershed Restoration Initiative,http://www.columbiaestuary.org/,,46.3692,-123.5568,4/13/2010,6/30/2011,1,"This phase of the Grays River Restoration Project began conceptual level restoration designs for three potential project sites: Gudmundsen, Sorenson, and Gorley Springs. Local high school students worked with the project manager for three weeks to learn and apply monitoring techniques. If implemented, these projects will restore 6,000 feet of riparian buffers (between 50 and 100 feet wide), improve in-channel complexity with up to 12 large wood structures, and improve floodplain connectivity for three critical reaches of the Grays River.","Assessment, Planning, or Design; Baseline or Project Monitoring; Community Engagement",Instream Restoration,2
0820-EP-OR-WF,Partnership for the Umpqua Rivers,Jackson Creek Watershed Restoration Phase 2,http://www.umpquarivers.org/,Moved this point in GIS to more approximate location-FIXED LAT LONG FIELDS DONE,42.992363,-122.5429,7/8/2008,12/31/2009,1,"Funding for Phase 2 of the Jackson Creek Restoration Project resulted in the installation of large wood complexes to the stream channels. A large helicopter installed stable wood complexes to 1 mile of Jackson Creek, 2 miles of Falcon Creek, 1 mile of Abbott Creek and the lower 3 miles of Black Canyon Creek.  These wood complexes restored velocity refuges, gravel accumulations, floodplain connectivity and reduced low-flow channel widths.","Instream Log Jam Placement, Instream Large Wood Placement, Instream Rootwad Placement",Instream Restoration,2
0909-E-OR-F,Siuslaw Watershed Council ,Knowles Creek Fish Passage Monitoring,http://www.siuslaw.org/,Moved this point in the GIS-but not in LAT LONG yet DONE,44.013226,-123.784744,4/23/2009,9/30/2011,1,"This grant has helped to fund Knowles Creek long-term fish passage monitoring efforts. Salmonids were marked and released up stream of a smolt trap, then recorded when they enter the trap on their outward migration. The trap is used to monitor long-term trends in fish populations, monitor response to restoration activities, and is used as an educational tool for local schools and the community.","Baseline or Project Monitoring, Community Engagement",Instream Restoration,2
1011-E-OR-NW,Geos Institute,Little Butte Creek Meander Restoration,http://www.geosinstitute.org/,,42.451389,-122.869722,8/2/2010,11/30/2011,1,"The Little Butte Creek Meander Restoration Project worked to restore a straightened channel to its historic channel meander.  Efforts resulted in: increasing the stream length by approximately 0.2 miles; increasing the channel and floodplain connection; and increasing habitat complexity with large wood, pools, alcoves and off-channel habitats, gravel beds, and fine sediment depositional areas.  Geomorphic riffles were constructed by adding gravels and cobbles to the historic channel.","Stream Channel Reconfiguration, Off-channel Alcove Habitat Construction, Instream Boulder Placement, Instream Gravel Placement, Instream Large Wood Placement, Instream Rootwad Placement, Instream Log Jam Placement, Riparian Planting and Revegetation",Instream Restoration,2
1020-E-WA-NF,Underwood Conservation District,Little Wind River Community Habitat Restoration,http://w3.gorge.net/ucd/,,45.727732,-121.791546,5/3/2010,12/31/2011,0,"The Little Wind Community Habitat Restoration Project aims to restore processes that currently limit the recovery of salmon and steelhead in the Little Wind River. Work will include placement of large wood to increase soil deposition at key sites, and reconnection of a historic floodplain side channel system. At other sites, placement of channel-spanning structures will increase available spawning habitat.","Stream Channel Connectivity, Off-channel Habitat Construction, Instream Boulder Placement, Instream Large Wood Placement, Instream Log Jam Placement",Instream Restoration,2
0809-E-OR-W,Stream Restoration Alliance of the Middle Rogue,Louse Creek Restoration,http://www.sramiddlerogue.org/,Correct,42.516311,-123.413811,4/20/2009,12/30/2009,1,"This grant provided funding for phases 2 and 3 of the Louse Creek Restoration Project's instream restoration efforts.  The grantee added 20 log structures and boulder clusters, re-profiled 800 feet of bank, and replanted a 50 ft. riparian buffer. The large wood complexes improves gravel retention & sorting for spawning salmon; enhances channel complexity and pool structure; provides high water refuge; and adds organic material to the aquatic system.","Streambank Stabilization, Instream Boulder Placement, Instream Log Jam Placement, Riparian Planting and Revegetation",Instream Restoration,2
0812-E-WA-NF,Skagit Fisheries Enhancement Group,Lower Finney Creek Restoration,http://www.skagitfisheries.org/,GOOD,48.5077,-121.8044,6/10/2008,12/31/2009,1,"Grant funding for the Lower Finney Creek Restoration Project placed 28 large wood complexes in a 1.6 mile reach of Finney Creek, improving stream habitat conditions for salmonids.  The large wood complexes increased channel complexity, storage of sediment, and riparian development.  This was the fifth and final phase of instream restoration efforts in Finney Creek.","Instream Large Wood Placement, Instream Log Jam Placement, Instream Rootwad Placement",Instream Restoration,2
1004-EP-OR-WF,Confederated Tribes of the Warm Springs Reservation of Oregon,McGee Creek In-channel and Floodplain Restoration,http://www.warmsprings.com/warmsprings/Tribal_Services/Natural_Resources/,,45.45195,-121.7769,11/2/2010,10/31/2011,1,"This project is one component of a larger effort to restore natural processes in the Upper West Fork Hood Rivers 6th field watershed. This phase of restoration efforts entailed placement of 24 large wood structures, consisting of 800 pieces of wood, in the channel and floodplain along 1.3 miles of lower McGee Creek. Reconnection of the stream channel with the floodplain in the lower 1.3 miles of McGee Creek will increase the quantity and quality of Chinook salmon and steelhead trout spawning and rearing habitat.","Instream Log Jam Placement, Instream Large Wood Placement, Instream Rootwad Placement, ",Instream Restoration,2
0810-E-OR-NWF,The Freshwater Trust,Middle Fork John Day Channel Relocation Phase I,http://www.thefreshwatertrust.org/,,44.742031,-118.850128,6/30/2008,10/31/2009,1,"This grant provided funding to assist the Middle Fork John Day Channel Relocation and Riparian Restoration Project. Project activities included: restoration of the river channel to its historic configuration, which increased the stream length by 2,705 feet; enhancement of channel complexity via addition of 600 pieces of wood; and restoration of channel-floodplain connectivity by reconnecting two disconnected meanders.","Stream Channel Reconfiguration, Off-channel Alcove Habitat Construction, Instream Boulder Placement, Instream Log Jam Placement, Wetland Enhancement, Riparian Planting and Revegetation",Instream Restoration,2
0902-E-OR-F,The Freshwater Trust,Middle Fork John Day Channel Relocation Phase II,http://www.thefreshwatertrust.org/,,44.729248,-118.845085,5/18/2009,12/31/2010,1,Grant funding for the Middle Fork John Day Channel Relocation and Riparian Restoration Project continued reconnection of two obstructed and disconnected meanders; enhancement of channel complexity via addition of 600 pieces of wood; and restoration of 28 acres of channel-floodplain connectivity and riparian vegetation.,"Stream Channel Reconfiguration, Off-channel Alcove Habitat Construction, Instream Boulder Placement, Instream Log Jam Placement, Wetland Enhancement, Riparian Planting and Revegetation",Instream Restoration,2
1016-EP-OR-WF,Partnership for the Umpqua Rivers,Middle/Upper Jackson Creek Salmon and Steelhead Restoration,http://www.umpquarivers.org/,,45.783333,-122.75,8/16/2010,12/31/2011,0,"The Middle/Upper Jackson Creek Salmon and Steelhead Restoration Project worked to restore instream habitat through placement of large wood complexes along five miles of the upper reaches of Jackson Creek.  Approximately 300 pieces of large wood were used to restore velocity refuges, gravel accumulations, floodplain connectivity and to reduce low flow wetted channel widths.","Instream Large Wood Placement, Instream Log Jam Placement",Instream Restoration,2
1001-E-WA-NF,Chelan County Natural Resource Department,Nason N1 Oxbow Reconnection,http://www.co.chelan.wa.us/nr/default.asp,,47.7612,-120.7308,5/10/2010,2/28/2011,1,"This grant funded a report by the Chelan County Natural Resources Department to evaluate six project alternatives for road repair at the Nason Creek N1/KDIZ3 site.  Various community stakeholders, including USFWS and Yakama Nation Fisheries, have supported the alternative to reconnect natural stream processes in 77 acres of disconnected floodplain, allowing fish passage, creating off-channel habitat, and providing at least 1.5 miles of additional stream channel length.","Assessment, Planning, or Design; Baseline or Project Monitoring; Community Engagement",Instream Restoration,2
0901-E-OR-N,Confederated Tribes of the Warm Springs Reservation of Oregon,Oxbow Conservation Instream Habitat,http://www.warmsprings.com/warmsprings/Tribal_Services/Natural_Resources/,,44.652794,-118.679267,4/9/2009,12/31/2009,1,"Funding provided for The Oxbow Conservation Area Instream Habitat Project assisted in one phase of a watershed-scale project to recover the Middle Fork John Day River aquatic ecosystem. Work included removal of 34 channel-restricting rock barbs, installation of 15 large wood structures to create scour pools and provide habitat, and construction of two mid-channel gravel bar enhancements.","Dike or Levee Removal, Instream Boulder Placement, Instream Rootwad Placement, Instream Large Wood Placement",Instream Restoration,2
1102-E-OR-WF,Confederated Tribes of the Warm Springs Reservation of Oregon,Oxbow Tailings Restoration Phases 1 & 2,http://www.warmsprings.com/warmsprings/Tribal_Services/Natural_Resources/,,44.642996,-118.660752,7/6/2011,6/30/2013,0,"This restoration project will address the most degraded segment of aquatic habitat along the Middle Fork John Day River to significantly enhance steelhead and Chinook salmon populations. This project is located on the 1,022-acre Oxbow Conservation Area, owned and managed by the Tribes specifically for long-term anadromous fish benefit. As a whole, the project will remove approximately 11,600 feet of dredge mining-created channels from the early 1940s, which offer little or poor habitat, enhance 5,400 feet of existing river channel with habitat-rich features, and construct 7,600 of new channels, offering complex, diverse habitat for all life-stages of anadromous and resident fish. The Oxbow Tailings Project has been split into three phases: phase one (2011) addresses the existing south channel habitat; phase two (2012) removes the north channel and reconnects Granite Boulder Creek; and phase three (2013) reconstructs the channel of the lower river portion, removing the dredged channel and reconnects Ruby Creek to the River.","Stream Channel Connectivity, Stream Channel Reconfiguration, Dike or Levee Removal, Instream Boulder Placement, Instream Large Wood Placement, Instream Rootwad Placement, Instream Log Jam Placement, Riparian Planting and Revegetation",Instream Restoration,2
1005-EP-OR-WF,Coquille Watershed Association,Restoring Salmonid Habitat & Stream Dynamics in Rock Creek Phase II,http://www.coquillewatershed.org/,,42.709444,-124.056944,7/14/2010,12/31/2011,0,"Phase II of this project on Rock Creek of the South Fork Coquille watershed included both instream and riparian work. Instream placement of log cribs and boulders will provide complex rearing habitat, narrow the channel, and add sinuosity while aggressively recruiting spawning gravels. These actions combined with replanting of riparian areas are an effort to rectify the historic practices of riparian harvest, placer hydro mining and 'stream cleaning.'","Instream Log Jam Placement, Instream Large Wood Placement, Instream Boulder Placement, Riparian Planting and Revegetation",Instream Restoration,2
