grant_num,funder,prj_name,website,loc_notes,y_coord,x_coord,strt_date,end_date,completed,prj_desc,rest_activity,icon,map_icon
1006-E-OR-N,The Freshwater Trust,Rudio Creek Ranch Habitat Restoration Project,http://www.thefreshwatertrust.org/,GOOD,44.743869,-119.543578,5/3/2010,12/31/2011,0,"The Rudio Creek Ranch Restoration Project is a large-scale effort to restore this tributary of the North Fork John Day River. The project's objectives are to increase stream length and complexity, restore natural floodplain function, and restore riparian habitat for steelhead and spring Chinook. Project activities will include reconnection of the stream to its historic channel, and increasing channel, riparian and floodplain complexity along 2.4 miles of Rudio Creek.","Stream Channel Reconfiguration; Off-channel Pond Habitat Construction; Baseline or Project Monitoring; Assessment, Planning, or Design",Instream Restoration,2
0806-EP-WA-NF,Methow Conservancy,Salmon Habitat Restoration Through Beaver Reintroduction,http://www.methowconservancy.org,Kate is verifying location DONE,48.547436,-120.184715,5/14/2008,9/30/2009,1,"This grant supported the Methow Conservancy's efforts to use beavers to restore wetland and riparian habitat characteristics. This project relocated 54 beavers between 2008 and 2009 to six sites in both Cub and Libby Creeks. The beavers established at least six active sites. Beaver dam building and tree cutting resulted in increased water storage, higher late season flows, improved water quality, reductions in sedimentation, increased large wood recruitment, and increased channel complexity.","Beaver Introduction or Management, Community Engagement",Instream Restoration,2
0817-EP-OR-WF,USDA Forest Service - Mt. Hood National Forest,Salmon River Side Channel Reconnection,http://www.fs.usda.gov/mthood/,,45.349899,-121.989799,6/15/2008,11/30/2010,1,"Funding provided to the Salmon River Watershed Restoration Project assisted in the restoration of three historic side channels and decommissioning of 1.6 miles of road into trail.  These three side-channels provide salmon and trout species with over 2.04 acres of newly reclaimed, high quality off-channel habitat.","Side-channel Habitat Construction, Off-channel Alcove Habitat Construction, Instream Large Wood Placement, Instream Rootwad Placement, Instream Log Jam Placement, Riparian Planting and Revegetation, Road Decommissioned or Closed, Culvert Removal, Road Drainage Improvements, Community Engagement",Instream Restoration,2
0802-EP-OR-WF,Coquille Watershed Association,South Fork Coquille Restoration,http://www.coquillewatershed.org/,,42.909444,-124.056944,8/19/2008,11/30/2009,1,"This project placed 22 log and bolder structures in Rock Creek, improving spawning and rearing habitats for salmon and steelhead by capturing spawning gravels, stabilizing banks, and narrowing and deepening widened channels.","Instream Boulder Placement, Instream Large Wood Placement, Instream Log Jam Placement",Instream Restoration,2
1012-E-ID-N,Nez Perce Tribe ,Spring Creek Wetland and Riparian Restoration,http://www.nezperce.org/Official/departmentofnaturalresources.htm,,46.389242,-116.793139,8/23/2010,4/30/2011,1,The Spring Creek Wetland and Riparian Restoration Spring Project restored natural hydrologic function to a traditional wetland. Work included the removal of a concrete diversion head gate to restore passage of aquatic organisms; removal of old drain tile lines; removal of invasive weeds from the riparian area; reestablishment of eroded stream banks using wetland sod mats and plugs; and riparian buffer and upland plantings to reconnect and reestablish the riparian plant community.,"Wetland Restoration, Wetland Management, Riparian Planting and Revegetation, Push-up or Diversion Dam Removal",Instream Restoration,2
0803-EP-OR-WF,Illinois Valley Watershed Council,Sucker Creek Restoration,http://www.ivstreamteam.org/,,42.139652,-123.456406,6/11/2008,12/31/2009,1,"This Greyback/Sucker Creek Restoration Project involved removal of hazard trees and standing snags from a campground on Sucker Creek, and subsequent creation of large wood complexes in both Greyback and Sucker Creeks to increase the quantity and quality of Coho, Chinook salmon and steelhead habitat.",Instream Log Jam Placement,Instream Restoration,2
1103-E-OR-F,Illinois Valley Soil and Water Conservation District,Sucker Creek Restoration Phase 2A,http://www.ivstreamteam.org/,,42.160488,-123.515152,6/27/2011,4/30/2013,0,"Phase 2A of the Sucker Creek project aims to continue work immediately downstream of Phase 2, restoring the natural stream meander pattern and cooling Sucker Creek by realigning the mainstem through a mature forest. Major activities of this project include channel reconstruction, placement of large wood structures in the channel and floodplain, riparian planting, and road decommissioning.","Stream Channel Connectivity, Stream Channel Reconfiguration, Off-channel Habitat Construction, Instream Large Wood Placement, Instream Log Jam Placement, Road Decommissioned or Closed, Riparian Planting and Revegetation",Instream Restoration,2
1007-E-OR-F,Illinois Valley Watershed Council,Sucker Creek Restoration Phase II,http://www.ivstreamteam.org/,,42.163456,-123.497826,4/6/2010,5/30/2011,1,"Phase II of the Sucker Creek Restoration Project continued work just downstream of the prior year and included: realignment of the main stem; addition of stream sinuosity; narrowing of the channel; incorporation of a proper ratio of riffle structures, runs and glides; decommissioning of 0.8 miles of road; and placement of large wood structures.","Stream Channel Reconfiguration, Road Decommissioned or Closed, Instream Log Jam Placement",Instream Restoration,2
0904-EP-OR-NF,Illinois Valley Watershed Council,Sucker Creek Stream Restoration Phase I,http://www.ivstreamteam.org/,,42.157719,-123.474335,5/29/2009,12/31/2010,1,This grant provided funding to phase one of the Sucker Creek Stream Restoration Project. Work included creation of approximately 0.4 miles of new side channel with connection to a one-acre rearing pond; planting of trees and shrubs in the riparian area; and constructing off-channel habitat features.,"Off-channel Pond Habitat Construction, Side-channel Habitat Construction, Riparian Planting and Revegetation",Instream Restoration,2
0906-E-WA-N,Northwest Watershed Institute,Tarboo Creek Restoration,http://nwwatershed.org/,GOOD-NEED CARTOGRAPHIC AIDE,47.887367,-122.820175,4/24/2009,5/31/2010,1,"Funding to the Tarboo Creek Restoration Project provided enhancement of 30 acres of critical habitat, including 1500 linear feet of associated off-channel swales and floodplain wetlands. Work included placement of more than 200 logs, plugging of two drainage ditches to re-route spring flow to historic wetland swales, and removal of a road that crossed one of the wetlands. Tarboo Creek is the main freshwater source to Tarboo-Dabob Bay, one of the most important bays in Washington for shellfish production. ","Culvert Removal, Road Decommissioned or Closed, Wetland Restoration, Instream Large Wood Placement, Riparian Planting and Revegetation, Community Engagement",Instream Restoration,2
0816-EP-OR-WF,USDA Forest Service - Mt. Hood National Forest,Upper Middle Fork Hood River Restoration,http://www.fs.usda.gov/mthood/,,45.465556,-121.637778,4/1/2008,11/30/2009,1,Funding to the Clear Branch Creek Project assisted instream and floodplain restoration efforts. Approximately 500 logs were placed by helicopter from river mile 2.6 to river mile 3.1 in Clear Branch Creek. The creek is part of ongoing efforts to reverse the decline of the native bull trout population in the Upper Middle Fork Hood River 6th field watershed. ,"Instream Large Wood Placement, Instream Rootwad Placement",Instream Restoration,2
0811-E-OR-WF,Partnership for the Umpqua Rivers,Upper South Umpqua River Restoration Phase 2,http://www.umpquarivers.org/,,43.14275,-122.54335,6/21/2008,9/30/2011,1,"This grant provided funding for Phase 2 of the Upper South Umpqua Instream Restoration Project. A helicopter placed 134 pieces of large wood at nine sites covering two miles of the Black Rock Fork Creek to increase the channel roughness. Increased channel complexity now provides salmonid winter habitat during high flows, and the narrowing of channel width improved spawning and rearing habitat. ","Instream Large Wood Placement, Instream Log Jam Placement, Instream Rootwad Placement",Instream Restoration,2
1009-E-OR-N,McKenzie River Trust,Waite Ranch Tidal Wetland Restoration Project,http://mckenzieriver.org/,,43.99,-124.027,5/19/2010,9/30/2011,1,"The Waite Ranch Tidal Wetland Restoration Project will lead to restoration of 217 acres of tidal wetlands in the lower Siuslaw River estuary. Funding for the current phase included site assessment, baseline inventories and initial data delivery for development of the preliminary restoration design. The overarching goal of the project is to restore habitat to include estuarine intertidal emergent, scrub-shrub and forested wetland characteristics. ","Assessment, Planning, or Design; Baseline or Project Monitoring",Instream Restoration,2
1104-E-OR-N,McKenzie River Trust,Waite Ranch Tidal Wetland Restoration Project Phase 2,http://mckenzieriver.org/,,43.99,-124.027,12/1/2011,12/1/2013,0,"The Waite Ranch Tidal Wetland Restoration Project will lead to restoration of 217 acres of tidal wetlands in the lower Siuslaw River estuary. Funding for this project phase supports finalization of restoration designs, permitting and development of outreach materials. The overarching goal of the project is to restore habitat to include estuarine intertidal emergent, scrub-shrub and forested wetland characteristics. ","Assessment, Planning, or Design; Baseline or Project Monitoring",Instream Restoration,2
1019-E-OR-W,Tillamook Bay Watershed Council,Waldron Creek Enhancement Project,http://www.tillamookbaywatershedcouncil.net/,,45.582989,-123.844328,5/3/2010,5/31/2011,1,"The Waldron Creek Enhancement Project replaced a 25-foot concrete bridge that was constricting stream flow with a new 50-foot channel-spanning steel bridge. Instream efforts included placement of 13 large wood structures. In conjunction, over 500 trees were planted to diversify composition of the hardwood-dominated riparian zone. ","Culvert Replacement, Instream Log Jam Placement",Instream Restoration,2
1021-E-OR-WFB,Williams Creek Watershed Council,West Fork Williams Stream Restoration,http://williamswatershed.org/,,42.183052,-123.340767,8/2/2010,12/31/2011,0,"Funding provided to the West Fork Williams Creek Project assisted instream restoration efforts along two miles of the West Fork of Williams Creek.  Log and boulder structures were placed to slow water, and develop backwater pools and deep scour pools.  These structures also provide places for gravel and sediment to collect and form complex habitat areas, effectively raising the streambed to pre-impact levels. ","Instream Boulder Placement, Instream Large Wood Placement, Instream Log Jam Placement",Instream Restoration,2
1013-E-OR-F,North Fork John Day Watershed Council,Granite Creek Riparian Revegetation Project,http://www.nfjdwc.org/,,44.796108,-118.438303,7/7/2010,12/31/2011,0,"The Granite Riparian Revegetation Project provides riparian re-vegetation and noxious weed control treatment efforts in the North Fork John Day basin. Work includes 2 miles of Granite Creek, 1 mile of Clear Creek, and 5 miles of decommissioned Forest Service roads in the Granite Creek Watershed. The project builds upon large-scale floodplain restoration efforts that have taken place in the Granite Creek Watershed over the last decade. ","Riparian Planting and Revegetation, Riparian Plant Removal or Control, Upland Planting, Community Engagement",Riparian Restoration,3
1018-E-WA-F,Skagit River System Cooperative,Queensgate Floodplain and Riparian Restoration,http://www.skagitcoop.org/,,48.331584,-121.545095,6/15/2010,12/31/2012,0,"The Queensgate Floodplain and Riparian Restoration Project restored and enhanced riparian vegetation conditions over approximately 50 acres within the Skagit Wild and Scenic River System. The project removed 3,900 feet of road surface fill material from floodplain swales, restoring floodplain connectivity and channel migration.  Existing conifer forest plantations received targeted thinning treatments, and noxious and non-native vegetation was removed in 3 acres of disturbed riparian areas and replanted with native species.","Road Decommissioned or Closed, Culvert Removal, Thinning, Riparian Planting and Revegetation, Riparian Plant Removal or Control,",Riparian Restoration,3
0808-E-OR-NWF,Stream Restoration Alliance of the Middle Rogue,Riparian Restoration & Stewardship Project,http://www.sramiddlerogue.org/,,42.230854,-123.256264,4/20/2009,9/30/2011,1,Grant funding provided to The Middle Rogue Watershed Council's Riparian Stewardship Project involved 17 private landowners in restoration of riparian function on their properties.  The project goal was establishment of a healthy riparian forest buffer with adequate canopy coverage to keep stream temperatures low and limit bank erosion.,"Riparian Planting and Revegetation, Riparian Plant Removal or Control, Community Engagement",Riparian Restoration,3
1111-E-OR-WF,Sandy River Basin Watershed Council,Salmon River & Still Creek Riparian Restoration,http://www.sandyriver.org/,,45.272324,-121.937019,8/2/2011,7/31/2013,0,"This project will restore degraded campsite areas near a decommissioned road in the Salmon River watershed, and improve habitat conditions in the Summer Homes area of Still Creek. The goals of the project are to improve habitat conditions for salmon and steelhead by restoring 3 miles of degraded riparian habitat along the Salmon River and South Fork Salmon River and to restore 4 miles of Still Creek and its associated floodplain on National Forest Lands. Objectives include increased diversity in riparian forest stands, replanting and/or decommissioning of some campsites, and invasive species removal on the Salmon, and tree planting, invasive species removal, large wood placement, side channel reconnection and landowner outreach in Still Creek.","Dispersed Campgrounds Decommissioned, Riparian Planting and Revegetation, Instream Large Wood Placement, Instream Log Jam Placement, Community Engagement",Riparian Restoration,3
0908-E-OR-F,Sandy River Basin Watershed Council ,Salmon River Side Channel Revegetation,http://www.sandyriver.org/,,45.315606,-121.949453,8/18/2009,5/31/2011,1,"Grant funds supported revegetation of Salmon River historic side channels that were restored by the Forest Service, BLM and other partners. High school students from the greater Portland area installed native plants along three side channels, while contractors and other local volunteers performed invasive plant removal.","Riparian Planting and Revegetation, Riparian Plant Removal or Control, Community Engagement",Riparian Restoration,3
1014-E-WA-N,Northwest Watershed Institute,Tarboo Creek Stream and Wetland Restoration ,http://nwwatershed.org/,GOOD-NEED CARTOGRAPHIC AIDE,47.882933,-122.819206,4/24/2010,3/30/2011,1,"The Tarboo Creek Stream and Wetland Restoration Project restored a ditched tributary to meandering wetlands. Work included removal of invasive blackberry and weeds and filling in of the old ditch to create a new meandering stream channel with large wood.  Following reconstruction, two major 'Plant-A-Thons' were held, where over 260 children and parents planted over 5,000 trees. ","Wetland Enhancement, Wetland Restoration, Instream Large Wood Placement, Riparian Planting and Revegetation, Community Engagement",Riparian Restoration,3
1017-E-WA-N,Skagit Fisheries Enhancement Group,Upper Skagit Invasive Plant Control Project,http://www.skagitfisheries.org/,moved in GIS-not in LAT LONG DONE,48.283796,-121.347179,5/3/2010,12/31/2011,0,"The Upper Skagit Invasive Plant Control Project is an ongoing effort to control the invasive knotweed plant (polygonum cuspidatum) in the Upper Skagit watershed.  Since 2001, this long-term project has achieved 50% control of knotweed in the Upper Skagit watershed and has become a model project in Washington State. When the invasive knotweed is left untreated, healthy riparian areas are be unable to develop and habitat functions are lost.","Riparian Plant Removal or Control, Baseline or Project Monitoring",Riparian Restoration,3
0813-E-WA-NF,Skagit River System Cooperative,Big Creek Road Restoration,http://www.skagitcoop.org/,,48.37,-121.42,7/2/2008,10/31/2011,1,"Grant funding to the Big Creek Sediment Reduction assisted the decommissioning of 8 miles of forest roads within the Suiattle River basin.  A total of 2.7 miles of road 2640, all 0.3 miles of road 2642016, and 5.0 miles of road 2643 were removed in the Big Creek watershed.  The sediment reduction efforts in Big Creek are important for Spring Chinook spawning and rearing habitat.","Road Decommissioned or Closed, Culvert Removal, Road Drainage Improvements, Riparian Planting and Revegetation",Sediment Reduction,4
1113-E-WA-F,The Wilderness Society,Chewuch Transportation Plan & Collaboration,http://wilderness.org/,,48.747406,-120.136403,6/27/2011,4/30/2013,0,"The Wilderness Society (TWS) and the Forest Service's Methow Valley Ranger District (MVRD) are working together to reduce the environmental impacts of roads within the 334,600 acre Chewuch River basin on the Okanogan-Wenatchee National Forest.  The watersheds ~6081-mile road system, of which ~95% is within the 191,300 acre Lower Chewuch Watershed, is identified as a principal anthropogenic effect that diminishes critical habitat for three federally listed fish species: spring Chinook, steelhead and bull trout. During the next three years, TWS and MVRD will undertake a collaborative public process to inform road access decisions and begin to implement restoration projects in the Lower Chewuch Watershed. The Chewuch collaboration will provide a model for many other national forests that will soon be undertaking roads analyses in response to national Forest Service direction.","Community Engagement; Assessment, Planning, or Design",Sediment Reduction,4
0903-E-WA-NF,Gifford Pinchot Task Force,Clear Lewis Road Removal ,http://www.gptaskforce.org/,,46.171331,-121.98495,4/29/2009,12/31/2010,1,"This grant contributed to The Clear-Lewis Road Removal Project, which removed 7.9 miles of road to improve habitat for winter steelhead, spring Chinook, Coho and resident and cutthroat trout. The project expanded the unroaded area around the Spencer Ridge roadless area by 3,000 acres, benefiting deer, elk, wolves and other wildlife.  By removing these roads, the natural flow of water was restored for 10 perennial streams and the road density was reduced by 24% to approximately 1.27 miles/sq. mile.","Road Decommissioned or Closed, Road Drainage Improvements, Culvert Removal, Streambank Stabilization, Riparian Planting and Revegetation",Sediment Reduction,4
1112-E-OR-WF,Siuslaw Institute,Fivemile Bell Restoration Phase I,http://www.siuslawinstitute.org/,,43.842108,-124.029028,9/18/2011,8/31/2013,0,"The Fivemile Bell Restoration Project is a planned 10-year phased restoration project that will phase in restorative actions to balance fish and wildlife needs. Phase I of project implementation will set the stage for rehabilitation of the uplands and valley bottom of this watershed. Activities for Phase I will include the repair of drainage features in the main valley road to allow equipment access for future restorative actions. Future restorative actions include placement of large wood with excavator and helicopter, reconstruction of stream channels, valley re-grading, re-establishment of native valley bottom vegetation, and decommissioning of old forest access roads and stream crossings throughout the uplands that are hampering ecological healing. ","Road Decommissioned or Closed, Road Drainage Improvements, Culvert Removal, Instream Large Wood Placement, Riparian Planting and Revegetation, Riparian Plant Removal or Control",Sediment Reduction,4
1110-E-OR-F,Pacific Rivers Council,Stormproofing Sucker Creek,http://pacificrivers.org/,Place in centroid of Sucker Creek FWTRSHD,42.110897,-123.413048,6/27/2011,4/30/2013,0,"The long-term goal of this project is to reduce road-related sedimentation and habitat degradation from roads in the Sucker Creek watershed.  The primary activity supported by this grant is a field-based sediment source needs assessment to identify Forest Service road-related sediment sources, assess relative risks on a watershed scale, and evaluate treatment options. The secondary activity is development of technical design and implementation reviews of stormproofing treatments now in progress as a result of sediment source work done in 2010 for the Grayback Creek portion of the Sucker Creek watershed. ","Assessment, Planning, or Design; Baseline or Project Monitoring; Community Engagement",Sediment Reduction,4
0907-E-OR-NF,Pacific Rivers Council ,Sucker Creek Sediment Reduction,http://pacificrivers.org/,,42.102661,-123.47049,4/24/2009,12/31/2010,1,"This grant provided funding for The Greyback Creek Sediment Source Assessment and Sediment Control Plan. This assessment of roads within the Grayback Creek watershed is being used by the Forest Service as the foundation for road remediation and removal efforts, and is also being employed in further planning efforts for the entire road system in the Sucker Creek watershed. Additionally, the Forest Service used the report to obtain funding for sediment remediation efforts from the Legacy Roads and Trails program.","Assessment, Planning, or Design; Community Engagement; Baseline or Project Monitoring",Sediment Reduction,4
0814-E-WA-F,Skagit River System Cooperative,Tenas Creek Road Restoration,http://www.skagitcoop.org/,,48.32,-121.37,10/13/2008,11/12/2009,1,Funding to the Tenas Creek Sediment Reduction Project resulted in upgrading 4.1 miles and decommissioning 3.9 miles of Forest Road 2660 within the Suiattle River basin. The reduced sediment impacts in Tenas Creek are important for providing adequate habitat for Spring Chinook spawning and rearing. ,"Road Decommissioned or Closed, Culvert Removal, Road Drainage Improvements, Riparian Planting and Revegetation",Sediment Reduction,4
1109-E-OR-WF,North Fork John Day Watershed Council,Wall Creek Watershed Riparian  Restoration,http://www.nfjdwc.org/,ADDED xy,44.997517,-119.510262,8/8/2011,7/31/2013,0,"This project will improve water quality and fish and wildlife habitat in the watershed through road decommissioning, native seedling planting, and riparian hardwood planting and caging. Two and four tenths miles of streamside roads adjacent to the headwaters of East Fork Alder Creek will be decommissioned to reduce soil compaction and erosion, improve hydrologic function, and encourage riparian vegetation growth. Native seed mix from existing stocks will be sown in the fall after decommissioning. Ten species of riparian hardwoods will be planted and caged at 100 sites on or adjacent to 20 miles of previously decommissioned and seeded streamside roads, and along 7 miles of streams without roads.","Road Decommissioned or Closed, Culvert Removal, Riparian Planting and Revegetation, Upland Planting",Sediment Reduction,4
=======
FID,the_geom,grant_num,funder,prj_name,website,loc_notes,y_coord,x_coord,strt_date,end_date,completed,prj_desc,rest_activ,icon,map_icon
wwri.1,POINT (-118.808525 44.66433),0819-E-OR-W,Grant Soil and Water Conservation District,Camp Creek Legacy Log Weir Removal Phase 1,,,44.66433,-118.808525,4/15/2009,12/31/2011,0,"""Funding to Phase 1 of the Camp Creek Log Weir Removal Project addressed legacy","""Weir Removal, Instream Large Wood Placement""",Barrier Removal,1
wwri.2,POINT (-118.826141 44.65279),1003-E-OR-WF,Grant Soil and Water Conservation District,Camp Creek Log Weir Removal Project Phase II,,,44.65279,-118.826141,8/2/2010,12/31/2011,0,"""Funding for phase two of the Camp Creek Log Weir Removal Project supported the","""Weir Removal, Instream Large Wood Placement""",Barrier Removal,1
wwri.3,POINT (-118.796768 44.686096),0818-EP-OR-WF,USDA Forest Service- Malheur National Forest,Camp Creek Watershed Culvert Replacement,http://www.fs.usda.gov/malheur/,,44.686096,-118.796768,10/1/2008,9/30/2009,1,"""The Granite Boulder Creek Culvert Replacement Project replaced two side-by-side","""Culvert Replacement, Weir Removal""",Barrier Removal,1
wwri.4,POINT (-121.516667 45.766667),1101-E-WA-N,Confederated Tribes and Bands of the Yakama Nation,Condit Dam Riparian Restoration,http://www.yakamanation-nsn.gov/index.php,,45.766667,-121.516667,12/1/2011,12/1/2013,0,"""Since 1913, the Condit Hydroelectric Project at rivermile 3.3 of the White Salm","""Large Dam Removal, Riparian Planting and Revegetation, Community Engagement""",Barrier Removal,1
wwri.5,POINT (-118.795296 44.897305),0905-E-OR-NWF,North Fork John Day Watershed Council,Desolation Creek Watershed Culvert Replacement,http://www.nfjdwc.org/,fixed in the GIS-not in the LAT LONG DONE,44.897305,-118.795296,5/12/2009,9/30/2011,1,"""The Bruin Creek Culvert Removal Project replaced a failed, perched culvert with","""Culvert Replacement, Streambank Stabilization """,Barrier Removal,1
wwri.6,POINT (-122.983889 42.433333),0804-E-OR-N,Jackson County,Gold Ray Dam Removal Sediment Study,http://www.co.jackson.or.us,,42.433333,-122.983889,7/16/2008,12/31/2009,1,"""This grant funded a sediment study necessary to obtain permits for removal of t","""Baseline or Project Monitoring; Assessment, Planning, or Design""",Barrier Removal,1
